{
  "@id": "iac:person-00002799",
  "@type": [
    "iac:Person",
    "iac:Scholar"
  ],
  "labels": {
    "prefLabel": {
      "tr": "FUAD PAŞA, Keçecizâde"
    },
    "description": {
      "tr": "Asıl adı Mehmed Fuad olup 5 Safer 1230’da (17 Ocak 1815) İstanbul’da doğdu. Babası ünlü şair Keçecizâde İzzet Molla’dır. Annesi Hibetullah Hanım’ın nesebi Merzifonlu Kara Mustafa Paşa’ya kadar uzanır. Önce ilmiye yolunda ilerlemek amacıyla Arapça ve Farsça öğrendi. Ancak babasının Sivas’a sürülmesi üzerine genç yaşta Mekteb-i Tıbbiyye’ye girmek zorunda kaldı; buradaki öğrenimin Fransızca olması sayesinde Fransızca’yı da öğrendi. Tıbbiyeden doktor yüzbaşı olarak mezuniyetinin ardından Vali Çengeloğlu Tâhir Paşa ile birlikte Trablusgarp’a gitti. Dönüşte Mustafa Reşid Paşa’nın teşvikiyle meslek değiştirerek Kasım 1837’de Bâbıâli tercüme kalemine girdi; 1839’da buranın mütercim-i evvelliğine yükseltildi. Mehmed Şekib Efendi (Paşa) Londra büyükelçiliğine tayin edilince sefâret başkâtibi olarak onunla birlikte Londra’ya gitti. Orada iki yıl Şekib Efendi’nin, bir yıl kadar da Âlî Efendi’nin (Paşa) maiyetinde çalıştı. Londra’da bir süre maslahatgüzarlık da yaptı. Bilgisini ve görgüsünü arttırmış olarak yurda dönen Fuad Efendi, İspanya Kraliçesi Elizabeth’e Abdülmecid’in cevabî mektubunu götürmek ve iki devlet arasındaki dostluğu kuvvetlendirmek için 1844’te Madrid’e gönderildi. Aynı zamanda kendisine Portekiz’e geçmesi ve genç Portekiz kraliçesine padişahın selâmlarını bildirmesi tâlimatı da verildi. Bir yıldan fazla İspanya ve Portekiz’de kalan Fuad Efendi Temmuz 1845’te Dîvân-ı Hümâyun tercümanlığına, 18 Şubat 1847’de rütbe-i ûlâ sınıf-ı evveli ile Dîvân-ı Hümâyun âmedciliğine tayin edildi. Macarlar’ın 1848’de Avusturya’ya karşı başlattıkları bağımsızlık hareketleri Eflak’a da sıçrayınca Bükreş’e gönderildi. Orada asayişi sağlamaya çalıştı. Avusturya’ya yardım eden Rusya’ya karşı Lehler de ayaklanmıştı. Bir kısım Macar ve Leh milliyetçisinin Osmanlı Devleti’ne sığınması üzerine Avusturya ve Rusya bunların iadesini istedi. Bâbıâli bunu reddedince savaş tehdidinde bulundular. Osmanlı hükümeti konuyu barış yoluyla halletmek için, Bükreş’te bulunan Fuad Efendi’yi fevkalâde murahhas büyükelçi sıfatıyla Rus çarı nezdine göndermeye karar verdi. Padişahın mektubunu götüren Fuad Efendi 5 Ekim 1849’da Petersburg’a vardı. Rus yetkililerle ve bizzat çarla görüşerek meseleyi barış yoluyla halletti. Bu başarısından dolayı 29 Kasım 1849’da bâlâ rütbesi verilerek sadâret müsteşarlığına getirildi. 11 Nisan 1850’de İstanbul’a dönen Fuad Efendi’ye imtiyaz nişanı verildi. İstanbul’da üç dört ay kaldıktan sonra romatizmasını tedavi ettirmek üzere Bursa’ya giderken Cevdet Efendi’yi de (Paşa) beraberinde götürdü. Burada kaldığı bir ay zarfında Cevdet Efendi ile birlikte Kavâid-i Osmâniyye ’yi, ayrıca Şirket-i Hayriyye’nin nizamnâme lâyihasını kaleme aldı. Bursa’dan döndükten sonra 1850 yılı ortalarında teşkil edilen Encümen-i Dâniş’e sadâret müsteşarı sıfatıyla dâhilî âza tayin edildi. Sadrazam Reşid Paşa tarafından hem Tanzimat’ın uygulanması hem de miras meselesini halletmek üzere Mısır’a gönderilen Fuad Efendi yine Cevdet Efendi’yi de yanına alarak 6 Nisan 1852’de Mısır’a vardı. Burada üç buçuk ay kadar kalarak Mısır’ın 60.000 kese olan yıllık vergisini Mısır Valisi Abbas Paşa ile anlaşarak 80.000 keseye çıkartmayı başardı. Bu hizmeti padişah tarafından takdir edilmiş olmalı ki Mısır’dan dönüşünde Âlî Paşa’nın sadârete geçişinden hemen sonra Hariciye Nâzırlığı’na getirildi (9 Ağustos 1852). Ancak bu sırada ortaya çıkan makāmât-ı mübâreke meselesinde Fransızlar’a meyletmesi, Rusya’ya statükonun korunacağını bildirirken Fransız sefâretine gönderilen takrirde, Beytülahm Kilisesi’nin büyük kapısına ait anahtarın Latinler’e verileceğinin kaydedilmesi, ayrıca “La vérité sur la question des lieux-saints” adlı lâyihasında Rusya’da baş gösteren iç karışıklıkları açıkça belirtmesi, Rusya’da Fuad Efendi’ye karşı büyük bir tepkinin doğmasına sebep oldu. çıkan makāmât-ı mübâreke meselesinde Fransızlar’a meyletmesi, Rusya’ya statükonun korunacağını bildirirken Fransız sefâretine gönderilen takrirde, Beytülahm Kilisesi’nin büyük kapısına ait anahtarın Latinler’e verileceğinin kaydedilmesi, ayrıca “La vérité sur la question des lieux-saints” adlı lâyihasında Rusya’da baş gösteren iç karışıklıkları açıkça belirtmesi, Rusya’da Fuad Efendi’ye karşı büyük bir tepkinin doğmasına sebep oldu. Görünüşte makāmât-ı mübâreke meselesini halletmek, gerçekte ise Ortodoks Osmanlı tebaasının hukukunu korumak amacıyla bazı imtiyazlar sağlamak için fevkalâde büyükelçi sıfatıyla 28 Şubat 1853’te İstanbul’a gelen Prens Mençikof usule aykırı olarak Fuad Efendi’yi ziyaret etmedi. Bunun üzerine Fuad Efendi yedi aydan fazla süren ilk Hariciye Nazırlığı görevinden istifa etti. İstifa sebebi, bizzat kendisinin ifadesine göre Rus baskısı karşısında devleti zor durumda bırakmamak ve ileride meydana gelebilecek olayların sorumluluğundan kurtulmaktı. Nitekim Fuad Efendi görüşünde haklı çıktı ve Bâbıâli Mençikof’un isteklerini kabul etmeyerek 4 Ekim 1853’te Rusya’ya savaş ilân etmek mecburiyetinde kaldı. Fuad Efendi, Kırım Harbi sırasında Yunanlılar’ın sınır tecavüzüne kalkışara"
    }
  },
  "profession": [
    "scholar"
  ],
  "provenance": {
    "derived_from": [
      {
        "source_id": "dia:fuad-pasa-kececizade",
        "source_type": "tertiary_reference",
        "page_or_locator": "DİA, slug=fuad-pasa-kececizade, https://islamansiklopedisi.org.tr/fuad-pasa-kececizade",
        "extraction_method": "structured_json",
        "edition_or_version": "Türkiye Diyanet Vakfı İslâm Ansiklopedisi (DİA), online edition; pipeline ETL."
      }
    ],
    "generated_by": {
      "pipeline_name": "canonicalize_person_dia",
      "pipeline_version": "v0.1.0"
    },
    "generated_at": "2026-05-04T15:34:05Z",
    "attributed_to": "https://orcid.org/0000-0002-7747-6854",
    "created": "2026-05-04T15:34:05Z",
    "modified": "2026-07-14T12:58:02Z",
    "license": "https://creativecommons.org/licenses/by-sa/4.0/",
    "record_history": [
      {
        "change_type": "create",
        "changed_at": "2026-05-04T15:34:05Z",
        "changed_by": "https://orcid.org/0000-0002-7747-6854",
        "release": "v0.1.0-phase0",
        "note": "Initial canonicalization from DİA slug=fuad-pasa-kececizade (6 chunks) by dia adapter (Hafta 4)."
      },
      {
        "change_type": "update",
        "changed_at": "2026-05-04T15:39:54Z",
        "changed_by": "https://orcid.org/0000-0002-7747-6854",
        "release": "v0.1.0-phase0",
        "note": "Hafta 4 DİA place resolution: birth_place / death_place string matched to place namespace."
      },
      {
        "change_type": "update",
        "changed_at": "2026-07-14T12:58:02Z",
        "changed_by": "https://orcid.org/0000-0002-7747-6854",
        "release": "v0.1.0-phase0",
        "note": "dia-travel augment (H11 S11b): active_in_places from dia_travel.json (belirsizlik-korumalı birebir etiket eşlemesi; fuzzy yok)."
      }
    ],
    "deprecated": false
  },
  "death_temporal": {
    "start_ce": 1815,
    "approximation": "circa"
  },
  "note": "DİA cross-reference: slug=fuad-pasa-kececizade, URL: https://islamansiklopedisi.org.tr/fuad-pasa-kececizade || DİA birth place: İstanbul || DİA death place: 1869 || DİA death-date string: (1815-1869) || Chunk count: 6",
  "birth_place": "iac:place-00000735",
  "active_in_places": [
    "iac:place-00016509",
    "iac:place-00017936",
    "iac:place-00016806"
  ]
}
