{
  "@id": "iac:person-00009101",
  "@type": [
    "iac:Person",
    "iac:Scholar"
  ],
  "labels": {
    "prefLabel": {
      "en": "al-Khālidī",
      "tr": "el-Hâlidî",
      "ar": "الخالدي"
    },
    "originalScript": {
      "ar": "الخالدي"
    },
    "description": {
      "tr": "Edebiyata yakın bir fıkıh âlimi. Safed'in halkından (Filistin) doğum ve ölüm yeri.",
      "en": "A jurist with literary accomplishment, from the people of Safed (in Palestine), both birthplace and"
    },
    "transliteration": {
      "ar-Latn-x-alalc": "Aḥmad b. Muḥammad b. Yūsuf al-Khālidī"
    },
    "altLabel": {
      "tr": [
        "Ahmed b. Muhammed b. Yûsuf el-Hâlidî"
      ],
      "ar": [
        "أحمد بن محمد بن يوسف الخالدي"
      ]
    }
  },
  "profession": [
    "scholar"
  ],
  "provenance": {
    "derived_from": [
      {
        "source_id": "el-alam:1153",
        "source_type": "tertiary_reference",
        "page_or_locator": "al-Ziriklī, al-Aʿlām (8th ed. 2002), entry alam_id=1153",
        "extraction_method": "structured_json",
        "edition_or_version": "Khayr al-Dīn al-Ziriklī, al-Aʿlām (Beirut: Dār al-ʿIlm li’l-Malāyīn, 8th ed. 2002), 8 vols."
      }
    ],
    "generated_by": {
      "pipeline_name": "canonicalize_person_el_alam",
      "pipeline_version": "v0.1.0"
    },
    "generated_at": "2026-05-04T15:35:39Z",
    "attributed_to": "https://orcid.org/0000-0002-7747-6854",
    "created": "2026-05-04T15:35:39Z",
    "modified": "2026-07-14T11:35:23Z",
    "license": "https://creativecommons.org/licenses/by-sa/4.0/",
    "record_history": [
      {
        "change_type": "create",
        "changed_at": "2026-05-04T15:35:39Z",
        "changed_by": "https://orcid.org/0000-0002-7747-6854",
        "release": "v0.1.0-phase0",
        "note": "Initial canonicalization from al-Aʿlām alam_id=1153 by el-alam adapter (Hafta 4) [Track B — no DİA cross-ref]."
      },
      {
        "change_type": "update",
        "changed_at": "2026-05-04T15:38:07Z",
        "changed_by": "https://orcid.org/0000-0002-7747-6854",
        "release": "v0.1.0-phase0",
        "note": "Hafta 4 person→place resolution: 1 new active_in_places PID(s) added from Yâqūt notable_persons sidecar."
      },
      {
        "change_type": "update",
        "changed_at": "2026-07-14T11:35:23Z",
        "changed_by": "https://orcid.org/0000-0002-7747-6854",
        "release": "v0.1.0-phase0",
        "note": "alam-detail augment (H11 S10): gap-fill alt.ar+alt.tr+translit from alam_detail.json el-alam:1153."
      }
    ],
    "deprecated": false
  },
  "death_temporal": {
    "start_ah": 1034,
    "start_ce": 1625,
    "approximation": "exact"
  },
  "note": "El-Aʿlām (Ziriklī) cross-reference: alam_id=1153, heading_ar=الخالدي || Ziriklī century_ce=17 || Ziriklī place coords (city/region of activity): 32.96, 35.5",
  "active_in_places": [
    "iac:place-00007581"
  ]
}
