{
  "@id": "iac:person-00013671",
  "@type": [
    "iac:Person"
  ],
  "labels": {
    "prefLabel": {
      "en": "al-ʿUthmānī",
      "tr": "el-Osmânî",
      "ar": "العثماني"
    },
    "originalScript": {
      "ar": "العثماني"
    },
    "description": {
      "tr": "Cezûle âlimlerinden tarihçi. Fas'ın güneybatısında \"Sus\"ta yer alan Cezûle'nin âlimlerindendır.",
      "en": "Historian among the scholars of Gazula in 'Sus' in southwestern Morocco."
    },
    "transliteration": {
      "ar-Latn-x-alalc": "ʿAbd Allāh b. Muḥammad al-ʿUthmānī"
    },
    "altLabel": {
      "tr": [
        "Abdullâh b. Muhammed el-Osmânî"
      ],
      "ar": [
        "بعد الله بن محمد العثماني"
      ]
    }
  },
  "profession": [
    "historian"
  ],
  "provenance": {
    "derived_from": [
      {
        "source_id": "el-alam:6223",
        "source_type": "tertiary_reference",
        "page_or_locator": "al-Ziriklī, al-Aʿlām (8th ed. 2002), entry alam_id=6223",
        "extraction_method": "structured_json",
        "edition_or_version": "Khayr al-Dīn al-Ziriklī, al-Aʿlām (Beirut: Dār al-ʿIlm li’l-Malāyīn, 8th ed. 2002), 8 vols."
      }
    ],
    "generated_by": {
      "pipeline_name": "canonicalize_person_el_alam",
      "pipeline_version": "v0.1.0"
    },
    "generated_at": "2026-05-04T15:36:22Z",
    "attributed_to": "https://orcid.org/0000-0002-7747-6854",
    "created": "2026-05-04T15:36:22Z",
    "modified": "2026-07-14T11:35:23Z",
    "license": "https://creativecommons.org/licenses/by-sa/4.0/",
    "record_history": [
      {
        "change_type": "create",
        "changed_at": "2026-05-04T15:36:22Z",
        "changed_by": "https://orcid.org/0000-0002-7747-6854",
        "release": "v0.1.0-phase0",
        "note": "Initial canonicalization from al-Aʿlām alam_id=6223 by el-alam adapter (Hafta 4) [Track B — no DİA cross-ref]."
      },
      {
        "change_type": "update",
        "changed_at": "2026-05-04T15:37:40Z",
        "changed_by": "https://orcid.org/0000-0002-7747-6854",
        "release": "v0.1.0-phase0",
        "note": "Hafta 4 person→place resolution: 1 new active_in_places PID(s) added from Yâqūt notable_persons sidecar."
      },
      {
        "change_type": "update",
        "changed_at": "2026-07-14T11:35:23Z",
        "changed_by": "https://orcid.org/0000-0002-7747-6854",
        "release": "v0.1.0-phase0",
        "note": "alam-detail augment (H11 S10): gap-fill alt.ar+alt.tr+translit from alam_detail.json el-alam:6223."
      }
    ],
    "deprecated": false
  },
  "death_temporal": {
    "start_ah": 1382,
    "start_ce": 1962,
    "approximation": "exact"
  },
  "note": "El-Aʿlām (Ziriklī) cross-reference: alam_id=6223, heading_ar=العثماني || Ziriklī century_ce=20 || Ziriklī place coords (city/region of activity): 33.85, 35.6",
  "active_in_places": [
    "iac:place-00002109"
  ]
}
