{
  "@id": "iac:person-00005675",
  "@type": [
    "iac:Person",
    "iac:Ruler"
  ],
  "labels": {
    "prefLabel": {
      "tr": "MUHAMMED b. EBÜ’s-SÂC",
      "ar": "محمّد بن أبي الساج"
    },
    "originalScript": {
      "ar": "محمّد بن أبي الساج"
    },
    "altLabel": {
      "tr": [
        "Ebü’l-Müsâfir (Ebû Ubeydillâh) el-Afşîn Muhammed b. Ebi’s-Sâc Ya‘kūb Dîvdâd b. Yûsuf Dîvdest"
      ]
    },
    "description": {
      "tr": "Mâverâünnehir’in Üsrûşene (Usrûşana) bölgesinin yerli halkından Ebü’s-Sâc Ya‘kūb Divdâd b. Yûsuf Divdest’in oğludur. Bölgenin hükümdar ailesi mensuplarından Haydar b. Kâvûs el-Afşin’in kumandanlarından olan Divdâd daha sonra Abbâsîler’in hizmetine girerek önemli görevler üstlenmiştir. Kaynaklarda Afşîn b. Divdâd ve İbn Ebü’s-Sâc adlarıyla da zikredilen Muhammed b. Ebü’s-Sâc babasının ölümünün ardından, Halife Mu‘temid-Alellah’ın nâibi sıfatıyla iktidarı elinde tutan kardeşi Muvaffak-Billâh tarafından Tarîkimekke ve Haremeyn valiliğine tayin edildi (266/880). Bu yıllarda Abbâsîler’in idaresindeki birçok bölge âsilerin yönetimine geçmiş, valiler de başlarına buyruk hareket etmeye başlamışlardı. İbn Ebü’s-Sâc, Mekke’yi ele geçiren Muhammed el-Mahzûmî’yi yenerek şehirden çıkardı. Ertesi yıl gönderdiği askerler, Kûfe’yi işgal eden Heysem el-İclî ile savaşıp onun öncü kumandanını öldürdüler. Muhammed b. Ebü’s-Sâc, 268 (881-82) yılında Vâsıt yöresinde Ali b. Habîb el-Yeşkürî adlı Arap reisini bozguna uğrattı. Aynı yıl, hac kafilelerini ve yolcuları soyan Hârûn adlı eşkıyayı ortadan kaldırarak yol güvenliğini sağladı. Merkezden gelen bir orduyu da Muhammed el-Mahzûmî’nin hâkimiyeti altındaki Cidde’ye gönderdi. Mahzûmî’nin, içinde silâh ve değerli eşya bulunan iki gemisi ele geçirildi ve şehirdeki hâkimiyetine son verildi (269/882). Bu başarılarından dolayı Rahbe-Hadîse arasındaki bölgenin valiliğiyle (Cemâziyelâhir 269 / Aralık 882 - Ocak 883) Enbâr ve Rahbe şehirleri de onun idaresine verildi. İbn Ebü’s-Sâc, Fırat boylarına gitmek üzere Hicaz’dan ayrılacağı sırada ayaklanan göçebe Araplar’ın isyanını bastırıp Rahbe’ye geldiğinde buraya hâkim olan Araplar’ın mukavemetiyle karşılaşınca şehri ele geçirdi. Muhammed b. Ebü’s-Sâc, Ahmed b. Tolun’un vefatı üzerine (270/884) Musul ve el-Cezîre Valisi İshak b. Kündacık ile Suriye ve Mısır’ı Humâreveyh’in elinden almak için anlaştı. Muhammed ve İshak yapacakları sefer için hazırlanırken halifenin nâibi Muvaffak-Billâh’tan yardım istediler. Muvaffak-Billâh yardım göndereceğini bildirdiği halde emîrler yardım gelmeden harekete geçerek Suriye’yi ele geçirdiler. Bunun üzerine Mısır Hükümdarı Humâreveyh Suriye’ye bir ordu yolladı. Muhammed ve İshak, Muvaffak-Billâh’ın gönderdiği kuvvetlerin kendilerine katılması için Mısır ordusunu oyaladılar. Bu sırada kışın bastırmasıyla Mısırlı askerler Şeyzer’deki evlere dağıldılar (270/884). İki emîr, Muvaffak’ın oğlu Ebü’l-Abbas Ahmed (el-Mu‘tazıd-Billâh) kumandasında bir ordunun kendilerine katılmasından sonra Şeyzer’deki Mısır ordusuna baskın düzenleyip çok sayıda Mısır askerini öldürdüler. Humâreveyh bizzat kendisinin kumanda ettiği büyük bir orduyla Remle’ye geldi. Bu sırada Ebü’l-Abbas Ahmed’in Muhammed ve İshak’a hakaret etmesi Abbâsî ordusunda gerilime sebep oldu. Mu‘tazıd-Billâh, Humâreveyh’in üzerine yürüdüğünde Muhammed ile İshak karargâhlarına geri döndüler. Mu‘tazıd-Billâh, Tavâhîn savaşında (271/885) Mısır askerleri karşısında bozguna uğradı. Bu dönemde İshak ile Muhammed’in arası açıldı. İshak’ın Abbâsî iktidarını elinde tutan Muvaffak’la arası iyi idi. Bu durum karşısında Muhammed de hutbeyi Humâreveyh adına okutmaya başladı ve oğlu Divdâd’ı rehine olarak Mısır’a gönderdi. Humâreveyh, ona ve kumandanlarına 200.000 altından fazla para gönderdi. Ardından Suriye’ye giderek Bâlis şehrinde Muhammed ile buluştu. Bu dönemde İshak’ı bozguna uğratan ve sığındığı Mardin Kalesi’ni kuşatan Muhammed bir süre sonra kuşatmayı kaldırıp Sincar’a gitti. Orada bir Arap kabilesini mağlûp etti. Ardından Emîr İshak’a ait olan Musul ve el-Cezîre’yi ele geçirdi; buralarda önce Humâreveyh, sonra da kendi adına hutbe okuttu. Kendisine tekrar hücum eden İshak’ı beş ay içinde iki defa yendi (273/886-87). 274 (887-88) yılında çok sayıda asker toplayan Humâreveyh, Suriye’ye giden Emîr İshak’ı bozguna uğrattı. İshak kaçarak bir kaleye sığındı. Fakat Mısır hükümdarının Fırat’ı geçtiğini öğrenince ona elçi gönderip itaatini bildirdi. önce Humâreveyh, sonra da kendi adına hutbe okuttu. Kendisine tekrar hücum eden İshak’ı beş ay içinde iki defa yendi (273/886-87). 274 (887-88) yılında çok sayıda asker toplayan Humâreveyh, Suriye’ye giden Emîr İshak’ı bozguna uğrattı. İshak kaçarak bir kaleye sığındı. Fakat Mısır hükümdarının Fırat’ı geçtiğini öğrenince ona elçi gönderip itaatini bildirdi. Bunun üzerine Humâreveyh, Muhammed’i bırakıp İshak’tan yana bir tavır aldı. Fakat Muhammed Dımaşk’ı almak için Suriye’ye girince o da hemen harekete geçti (17 Zilkade 274 / 3 Nisan 888). İki ordu Dımaşk civarında Seniyyetül‘ukāb’da karşılaştı. Humâreveyh’in sayı ve silâh bakımından üstün ordusu karşısında yenilgiye uğrayan Muhammed Halep yoluyla Rakka’ya gitti; Humâreveyh de Rakka karşısındaki Fırat kıyısına geldi. Musul’a çekilen Muhammed, Humâreveyh Beled’e ulaşınca Hadîse’ye gitti. Mısır hükümdarı İshak’ı Muhammed’i takiple görevlendirdi. 20.000 kişilik bir orduyla Muhammed’in üzerine yürüyen İshak, Muhammed’e yenilerek Rakka’ya çekildi. Bu olaydan sonra Muhammed Dımaşk’a"
    }
  },
  "profession": [
    "ruler"
  ],
  "provenance": {
    "derived_from": [
      {
        "source_id": "dia:muhammed-b-ebus-sac",
        "source_type": "tertiary_reference",
        "page_or_locator": "DİA, slug=muhammed-b-ebus-sac, https://islamansiklopedisi.org.tr/muhammed-b-ebus-sac",
        "extraction_method": "structured_json",
        "edition_or_version": "Türkiye Diyanet Vakfı İslâm Ansiklopedisi (DİA), online edition; pipeline ETL."
      },
      {
        "source_id": "dia-chunks:muhammed-b-ebus-sac",
        "source_type": "tertiary_reference",
        "page_or_locator": "https://islamansiklopedisi.org.tr/muhammed-b-ebus-sac",
        "extraction_method": "structured_json",
        "edition_or_version": "TDV İslâm Ansiklopedisi (dia_chunks.json)"
      }
    ],
    "generated_by": {
      "pipeline_name": "canonicalize_person_dia",
      "pipeline_version": "v0.1.0"
    },
    "generated_at": "2026-05-04T15:34:42Z",
    "attributed_to": "https://orcid.org/0000-0002-7747-6854",
    "created": "2026-05-04T15:34:42Z",
    "modified": "2026-07-10T16:23:25Z",
    "license": "https://creativecommons.org/licenses/by-sa/4.0/",
    "record_history": [
      {
        "change_type": "create",
        "changed_at": "2026-05-04T15:34:42Z",
        "changed_by": "https://orcid.org/0000-0002-7747-6854",
        "release": "v0.1.0-phase0",
        "note": "Initial canonicalization from DİA slug=muhammed-b-ebus-sac (3 chunks) by dia adapter (Hafta 4)."
      },
      {
        "change_type": "update",
        "changed_at": "2026-07-10T16:23:25Z",
        "changed_by": "https://orcid.org/0000-0002-7747-6854",
        "release": "v0.1.0-phase0",
        "note": "AN Cat-B enrichment (H10 Stage 5, Tier-2 conf 1.0): gap-filled nothing (provenance only)."
      }
    ],
    "deprecated": false
  },
  "death_temporal": {
    "start_ah": 288,
    "start_ce": 901,
    "approximation": "exact"
  },
  "note": "DİA cross-reference: slug=muhammed-b-ebus-sac, URL: https://islamansiklopedisi.org.tr/muhammed-b-ebus-sac || DİA death-date string: (ö. 288/901) || DİA categories: hadis > rivayet || Chunk count: 3"
}
