{
 "@id": "iac:person-00018473",
 "@type": [
  "iac:Person",
  "iac:Scholar"
 ],
 "labels": {
  "prefLabel": {
   "en": "al-Rūyānī",
   "tr": "Rûyânî",
   "ar": "الروياني"
  },
  "originalScript": {
   "ar": "الروياني"
  },
  "description": {
   "tr": "Hadis hafızlarından",
   "en": "One of the Hadith scholars"
  },
  "transliteration": {
   "ar-Latn-x-alalc": "Muḥammad b. Hārūn al-Rūyānī, Abū Bakr"
  },
  "altLabel": {
   "tr": [
    "Muhammed b. Hârûn Rûyânî, Ebû Bekr"
   ],
   "ar": [
    "محمد بن هارون الروياني ، أبو بكر"
   ]
  }
 },
 "profession": [
  "scholar"
 ],
 "provenance": {
  "derived_from": [
   {
    "source_id": "el-alam:11546",
    "source_type": "tertiary_reference",
    "page_or_locator": "al-Ziriklī, al-Aʿlām (8th ed. 2002), entry alam_id=11546",
    "extraction_method": "structured_json",
    "edition_or_version": "Khayr al-Dīn al-Ziriklī, al-Aʿlām (Beirut: Dār al-ʿIlm li’l-Malāyīn, 8th ed. 2002), 8 vols."
   }
  ],
  "generated_by": {
   "pipeline_name": "canonicalize_person_el_alam",
   "pipeline_version": "v0.1.0"
  },
  "generated_at": "2026-05-04T15:37:19Z",
  "attributed_to": "https://orcid.org/0000-0002-7747-6854",
  "created": "2026-05-04T15:37:19Z",
  "modified": "2026-07-14T11:35:23Z",
  "license": "https://creativecommons.org/licenses/by-sa/4.0/",
  "record_history": [
   {
    "change_type": "create",
    "changed_at": "2026-05-04T15:37:19Z",
    "changed_by": "https://orcid.org/0000-0002-7747-6854",
    "release": "v0.1.0-phase0",
    "note": "Initial canonicalization from al-Aʿlām alam_id=11546 by el-alam adapter (Hafta 4) [Track B — no DİA cross-ref]."
   },
   {
    "change_type": "update",
    "changed_at": "2026-07-14T11:35:23Z",
    "changed_by": "https://orcid.org/0000-0002-7747-6854",
    "release": "v0.1.0-phase0",
    "note": "alam-detail augment (H11 S10): gap-fill alt.ar+alt.tr+kunya+translit from alam_detail.json el-alam:11546."
   },
   {
    "change_type": "update",
    "changed_at": "2026-07-30T20:24:08Z",
    "changed_by": "https://orcid.org/0000-0002-7747-6854",
    "note": "[h49_001] Aynı kişi kümesi (6481-18473) iki bağımsız mercekle (prosopografi + çürütme) yargılandı ve 'aynı kişi' kararı verildi; iac:person-00006481 lehine yumuşak-silindi. Gerekçe: Müsnedü'r-Rûyânî sahibi Muhammed b. Hârûn er-Rûyânî 307/919-20'de vefat etmiştir; A'lam'ın 10. yüzyıl 'Rûyânî' kaydı bu yıl aralığına ve nisbeye tam oturur."
   }
  ],
  "deprecated": true,
  "deprecated_in_favor_of": "iac:person-00006481"
 },
 "death_temporal": {
  "start_ah": 307,
  "start_ce": 920,
  "approximation": "exact"
 },
 "note": "El-Aʿlām (Ziriklī) cross-reference: alam_id=11546, heading_ar=الروياني || Ziriklī century_ce=10",
 "kunya": "أبو بكر"
}
