{
  "@id": "iac:person-00009744",
  "@type": [
    "iac:Person",
    "iac:Scholar"
  ],
  "labels": {
    "prefLabel": {
      "en": "al-Fujāʾa",
      "tr": "El-Fujâe",
      "ar": "الفجاءة"
    },
    "originalScript": {
      "ar": "الفجاءة"
    },
    "description": {
      "tr": "Irtidaddan sonra önemli kişilerden biri",
      "en": "One of the major figures of apostasy"
    },
    "transliteration": {
      "ar-Latn-x-alalc": "Iyās (al-Fujāʾa) ibn ʿAbdullāh ibn ʿAbdiyālīl al-Sulamī, from Banū Salīm, al-Tamīmī"
    },
    "altLabel": {
      "tr": [
        "İyâs (el-Fujâe) b. Abdullâh b. Abdiyâlîl es-Selâmî, Benî Selîm'den, et-Temîmî"
      ],
      "ar": [
        "إياس ( الفجاءة ) بن عبد الله بن عبد ياليل السلمي، من بني سليم، التميمي"
      ]
    }
  },
  "profession": [
    "scholar"
  ],
  "provenance": {
    "derived_from": [
      {
        "source_id": "el-alam:1847",
        "source_type": "tertiary_reference",
        "page_or_locator": "al-Ziriklī, al-Aʿlām (8th ed. 2002), entry alam_id=1847",
        "extraction_method": "structured_json",
        "edition_or_version": "Khayr al-Dīn al-Ziriklī, al-Aʿlām (Beirut: Dār al-ʿIlm li’l-Malāyīn, 8th ed. 2002), 8 vols."
      }
    ],
    "generated_by": {
      "pipeline_name": "canonicalize_person_el_alam",
      "pipeline_version": "v0.1.0"
    },
    "generated_at": "2026-05-04T15:35:45Z",
    "attributed_to": "https://orcid.org/0000-0002-7747-6854",
    "created": "2026-05-04T15:35:45Z",
    "modified": "2026-07-14T11:35:23Z",
    "license": "https://creativecommons.org/licenses/by-sa/4.0/",
    "record_history": [
      {
        "change_type": "create",
        "changed_at": "2026-05-04T15:35:45Z",
        "changed_by": "https://orcid.org/0000-0002-7747-6854",
        "release": "v0.1.0-phase0",
        "note": "Initial canonicalization from al-Aʿlām alam_id=1847 by el-alam adapter (Hafta 4) [Track B — no DİA cross-ref]."
      },
      {
        "change_type": "update",
        "changed_at": "2026-07-14T11:35:23Z",
        "changed_by": "https://orcid.org/0000-0002-7747-6854",
        "release": "v0.1.0-phase0",
        "note": "alam-detail augment (H11 S10): gap-fill alt.ar+alt.tr+translit from alam_detail.json el-alam:1847."
      }
    ],
    "deprecated": false
  },
  "death_temporal": {
    "start_ah": 11,
    "start_ce": 632,
    "approximation": "exact"
  },
  "note": "El-Aʿlām (Ziriklī) cross-reference: alam_id=1847, heading_ar=الفجاءة || Ziriklī century_ce=7"
}
