{
  "@id": "iac:person-00010914",
  "@type": [
    "iac:Person",
    "iac:Scholar"
  ],
  "labels": {
    "prefLabel": {
      "en": "Halīma al-Sacdiyya",
      "tr": "Halîme es-Sacdiyye",
      "ar": "حليمة السعدية"
    },
    "originalScript": {
      "ar": "حليمة السعدية"
    },
    "description": {
      "tr": "Peygamber Hz. Muhammed'in (s.a.v.) süt annelerinden biridir.",
      "en": "One of the wet nurses of the Prophet Muhammad (peace be upon him)."
    },
    "transliteration": {
      "ar-Latn-x-alalc": "Halīma b. Abī Dhuʾayb ʿAbd Allāh b. al-Ḥāris b. Shujna b. Jābir al-Sacdī al-Bakrī al-Huwaazī"
    },
    "altLabel": {
      "tr": [
        "Halîme b. Ebî Züeyb Abdullah b. el-Hâris b. Şucne b. Câbir es-Sacdî el-Bekrî el-Huvâzî"
      ],
      "ar": [
        "حليمة بنت أبي ذؤيب عبد الله بن الحارث بن شجنة بن جابر السعدي البكريالهوازني"
      ]
    }
  },
  "profession": [
    "scholar"
  ],
  "provenance": {
    "derived_from": [
      {
        "source_id": "el-alam:3141",
        "source_type": "tertiary_reference",
        "page_or_locator": "al-Ziriklī, al-Aʿlām (8th ed. 2002), entry alam_id=3141",
        "extraction_method": "structured_json",
        "edition_or_version": "Khayr al-Dīn al-Ziriklī, al-Aʿlām (Beirut: Dār al-ʿIlm li’l-Malāyīn, 8th ed. 2002), 8 vols."
      }
    ],
    "generated_by": {
      "pipeline_name": "canonicalize_person_el_alam",
      "pipeline_version": "v0.1.0"
    },
    "generated_at": "2026-05-04T15:35:56Z",
    "attributed_to": "https://orcid.org/0000-0002-7747-6854",
    "created": "2026-05-04T15:35:56Z",
    "modified": "2026-07-14T11:35:23Z",
    "license": "https://creativecommons.org/licenses/by-sa/4.0/",
    "record_history": [
      {
        "change_type": "create",
        "changed_at": "2026-05-04T15:35:56Z",
        "changed_by": "https://orcid.org/0000-0002-7747-6854",
        "release": "v0.1.0-phase0",
        "note": "Initial canonicalization from al-Aʿlām alam_id=3141 by el-alam adapter (Hafta 4) [Track B — no DİA cross-ref]."
      },
      {
        "change_type": "update",
        "changed_at": "2026-07-14T11:35:23Z",
        "changed_by": "https://orcid.org/0000-0002-7747-6854",
        "release": "v0.1.0-phase0",
        "note": "alam-detail augment (H11 S10): gap-fill alt.ar+alt.tr+translit from alam_detail.json el-alam:3141."
      }
    ],
    "deprecated": false
  },
  "death_temporal": {
    "start_ah": 8,
    "start_ce": 630,
    "approximation": "exact"
  },
  "note": "El-Aʿlām (Ziriklī) cross-reference: alam_id=3141, heading_ar=حليمة السعدية || Ziriklī century_ce=7 || Gender: F"
}
