{
  "@id": "iac:person-00012762",
  "@type": [
    "iac:Person",
    "iac:Scholar"
  ],
  "labels": {
    "prefLabel": {
      "en": "Ibn Umm al-Ḥākim",
      "tr": "İbn Ümmü'l-Hâkem",
      "ar": "ابن أم الحكم"
    },
    "originalScript": {
      "ar": "ابن أم الحكم"
    },
    "description": {
      "tr": "Emevî döneminde emirlerden biri",
      "en": "One of the emirs in the Umayyad era"
    },
    "transliteration": {
      "ar-Latn-x-alalc": "ʿAbd al-Raḥmān b. ʿAbdullāh b. Abī ʿAqīl al-Thaqafī"
    },
    "altLabel": {
      "tr": [
        "Abdurrahman b. Abdullah b. Ebî Akîl es-Sekafî"
      ],
      "ar": [
        "عبد الرحمن بن عبد الله بن أبي عقيل الثقفي"
      ]
    }
  },
  "profession": [
    "scholar"
  ],
  "provenance": {
    "derived_from": [
      {
        "source_id": "el-alam:5200",
        "source_type": "tertiary_reference",
        "page_or_locator": "al-Ziriklī, al-Aʿlām (8th ed. 2002), entry alam_id=5200",
        "extraction_method": "structured_json",
        "edition_or_version": "Khayr al-Dīn al-Ziriklī, al-Aʿlām (Beirut: Dār al-ʿIlm li’l-Malāyīn, 8th ed. 2002), 8 vols."
      }
    ],
    "generated_by": {
      "pipeline_name": "canonicalize_person_el_alam",
      "pipeline_version": "v0.1.0"
    },
    "generated_at": "2026-05-04T15:36:12Z",
    "attributed_to": "https://orcid.org/0000-0002-7747-6854",
    "created": "2026-05-04T15:36:12Z",
    "modified": "2026-07-14T11:35:23Z",
    "license": "https://creativecommons.org/licenses/by-sa/4.0/",
    "record_history": [
      {
        "change_type": "create",
        "changed_at": "2026-05-04T15:36:12Z",
        "changed_by": "https://orcid.org/0000-0002-7747-6854",
        "release": "v0.1.0-phase0",
        "note": "Initial canonicalization from al-Aʿlām alam_id=5200 by el-alam adapter (Hafta 4) [Track B — no DİA cross-ref]."
      },
      {
        "change_type": "update",
        "changed_at": "2026-07-14T11:35:23Z",
        "changed_by": "https://orcid.org/0000-0002-7747-6854",
        "release": "v0.1.0-phase0",
        "note": "alam-detail augment (H11 S10): gap-fill alt.ar+alt.tr+translit from alam_detail.json el-alam:5200."
      }
    ],
    "deprecated": false
  },
  "death_temporal": {
    "start_ah": 66,
    "start_ce": 685,
    "approximation": "exact"
  },
  "note": "El-Aʿlām (Ziriklī) cross-reference: alam_id=5200, heading_ar=ابن أم الحكم || Ziriklī century_ce=7"
}
