{
  "@id": "iac:person-00018431",
  "@type": [
    "iac:Person",
    "iac:Scholar"
  ],
  "labels": {
    "prefLabel": {
      "en": "al-Khābūshānī",
      "tr": "Habbûşânî",
      "ar": "الخبوشاني"
    },
    "originalScript": {
      "ar": "الخبوشاني"
    },
    "description": {
      "tr": "Şâfiî mezhebine mensup fukâhî. Nisbesi Nişâbûr çevresindeki Habbûşân'a, doğumu ise onun civarına ait",
      "en": "A Shāfiʿī jurist. His nisba refers to Khābūshān in the region of Nishapur, and he was born in its vi"
    },
    "transliteration": {
      "ar-Latn-x-alalc": "Muhammad b. al-Muwaffaq b. Saʿīd b. ʿAlī, Abū al-Barakāt Najm al-Dīn al-Khābūshānī"
    },
    "altLabel": {
      "tr": [
        "Muhammed b. el-Muvaffak b. Saîd b. Alî, Ebü'l-Berekât Necmüddîn el-Habbûşânî"
      ],
      "ar": [
        "محمد بن الموفق بن سعيد بن علي، أبو البركات نجم الدين الخبوشاني"
      ]
    }
  },
  "profession": [
    "scholar"
  ],
  "provenance": {
    "derived_from": [
      {
        "source_id": "el-alam:11502",
        "source_type": "tertiary_reference",
        "page_or_locator": "al-Ziriklī, al-Aʿlām (8th ed. 2002), entry alam_id=11502",
        "extraction_method": "structured_json",
        "edition_or_version": "Khayr al-Dīn al-Ziriklī, al-Aʿlām (Beirut: Dār al-ʿIlm li’l-Malāyīn, 8th ed. 2002), 8 vols."
      }
    ],
    "generated_by": {
      "pipeline_name": "canonicalize_person_el_alam",
      "pipeline_version": "v0.1.0"
    },
    "generated_at": "2026-05-04T15:37:18Z",
    "attributed_to": "https://orcid.org/0000-0002-7747-6854",
    "created": "2026-05-04T15:37:18Z",
    "modified": "2026-07-14T11:35:23Z",
    "license": "https://creativecommons.org/licenses/by-sa/4.0/",
    "record_history": [
      {
        "change_type": "create",
        "changed_at": "2026-05-04T15:37:18Z",
        "changed_by": "https://orcid.org/0000-0002-7747-6854",
        "release": "v0.1.0-phase0",
        "note": "Initial canonicalization from al-Aʿlām alam_id=11502 by el-alam adapter (Hafta 4) [Track B — no DİA cross-ref]."
      },
      {
        "change_type": "update",
        "changed_at": "2026-05-04T15:38:19Z",
        "changed_by": "https://orcid.org/0000-0002-7747-6854",
        "release": "v0.1.0-phase0",
        "note": "Hafta 4 person→place resolution: 2 new active_in_places PID(s) added from Yâqūt notable_persons sidecar."
      },
      {
        "change_type": "update",
        "changed_at": "2026-07-14T11:35:23Z",
        "changed_by": "https://orcid.org/0000-0002-7747-6854",
        "release": "v0.1.0-phase0",
        "note": "alam-detail augment (H11 S10): gap-fill alt.ar+alt.tr+kunya+translit from alam_detail.json el-alam:11502."
      }
    ],
    "deprecated": false
  },
  "death_temporal": {
    "start_ah": 587,
    "start_ce": 1191,
    "approximation": "exact"
  },
  "note": "El-Aʿlām (Ziriklī) cross-reference: alam_id=11502, heading_ar=الخبوشاني || Ziriklī century_ce=12 || Ziriklī place coords (city/region of activity): 30.04, 31.24",
  "active_in_places": [
    "iac:place-00009399",
    "iac:place-00011312"
  ],
  "kunya": "أبو البركات"
}
