{
  "@id": "iac:person-00011764",
  "@type": [
    "iac:Person",
    "iac:Scholar"
  ],
  "labels": {
    "prefLabel": {
      "en": "Salamah b. Aslam",
      "tr": "Selemete b. Eslim",
      "ar": "سلمة بن أسلم"
    },
    "originalScript": {
      "ar": "سلمة بن أسلم"
    },
    "description": {
      "tr": "Sahâbî, cesurlardan.",
      "en": "Companion, one of the brave."
    },
    "transliteration": {
      "ar-Latn-x-alalc": "Salamah b. Aslam b. Ḥarīsh al-Khuzrajī al-Anṣārī, Abū Saʿīd"
    },
    "altLabel": {
      "tr": [
        "Selemete b. Eslim b. Harîş el-Huzreci el-Ensârî, Ebû Saîd"
      ],
      "ar": [
        "سلمة بن أسلم بن حريش الخزرجي الأنصاري، أبو سعد"
      ]
    }
  },
  "profession": [
    "scholar"
  ],
  "provenance": {
    "derived_from": [
      {
        "source_id": "el-alam:4100",
        "source_type": "tertiary_reference",
        "page_or_locator": "al-Ziriklī, al-Aʿlām (8th ed. 2002), entry alam_id=4100",
        "extraction_method": "structured_json",
        "edition_or_version": "Khayr al-Dīn al-Ziriklī, al-Aʿlām (Beirut: Dār al-ʿIlm li’l-Malāyīn, 8th ed. 2002), 8 vols."
      }
    ],
    "generated_by": {
      "pipeline_name": "canonicalize_person_el_alam",
      "pipeline_version": "v0.1.0"
    },
    "generated_at": "2026-05-04T15:36:03Z",
    "attributed_to": "https://orcid.org/0000-0002-7747-6854",
    "created": "2026-05-04T15:36:03Z",
    "modified": "2026-07-14T11:35:23Z",
    "license": "https://creativecommons.org/licenses/by-sa/4.0/",
    "record_history": [
      {
        "change_type": "create",
        "changed_at": "2026-05-04T15:36:03Z",
        "changed_by": "https://orcid.org/0000-0002-7747-6854",
        "release": "v0.1.0-phase0",
        "note": "Initial canonicalization from al-Aʿlām alam_id=4100 by el-alam adapter (Hafta 4) [Track B — no DİA cross-ref]."
      },
      {
        "change_type": "update",
        "changed_at": "2026-07-14T11:35:23Z",
        "changed_by": "https://orcid.org/0000-0002-7747-6854",
        "release": "v0.1.0-phase0",
        "note": "alam-detail augment (H11 S10): gap-fill alt.ar+alt.tr+kunya+translit from alam_detail.json el-alam:4100."
      }
    ],
    "deprecated": false
  },
  "death_temporal": {
    "start_ah": 14,
    "start_ce": 635,
    "approximation": "exact"
  },
  "note": "El-Aʿlām (Ziriklī) cross-reference: alam_id=4100, heading_ar=سلمة بن أسلم || Ziriklī century_ce=7 || Ziriklī place coords (city/region of activity): 24.47, 39.61",
  "kunya": "أبو سعد"
}
