{
  "@id": "iac:person-00017634",
  "@type": [
    "iac:Person",
    "iac:Scholar"
  ],
  "labels": {
    "prefLabel": {
      "en": "Abū Ishāq Zāda",
      "tr": "Ebû İshak Zâde",
      "ar": "أبو إسحاق زاده"
    },
    "originalScript": {
      "ar": "أبو إسحاق زاده"
    },
    "description": {
      "tr": "Osmanlı Devleti'nin fakihlerinden",
      "en": "One of the jurists of the Ottoman State"
    },
    "transliteration": {
      "ar-Latn-x-alalc": "Muhammad 'Atā' Allāh b. Sharīf, Abū Ishāq Zāda"
    },
    "altLabel": {
      "tr": [
        "Muhammed Atâ'ullâh b. Şerîf, Ebû İshak Zâde"
      ],
      "ar": [
        "محمد عطاء الله بن شريف، أبو إسحاق زاده"
      ]
    }
  },
  "profession": [
    "scholar"
  ],
  "provenance": {
    "derived_from": [
      {
        "source_id": "el-alam:10604",
        "source_type": "tertiary_reference",
        "page_or_locator": "al-Ziriklī, al-Aʿlām (8th ed. 2002), entry alam_id=10604",
        "extraction_method": "structured_json",
        "edition_or_version": "Khayr al-Dīn al-Ziriklī, al-Aʿlām (Beirut: Dār al-ʿIlm li’l-Malāyīn, 8th ed. 2002), 8 vols."
      }
    ],
    "generated_by": {
      "pipeline_name": "canonicalize_person_el_alam",
      "pipeline_version": "v0.1.0"
    },
    "generated_at": "2026-05-04T15:37:07Z",
    "attributed_to": "https://orcid.org/0000-0002-7747-6854",
    "created": "2026-05-04T15:37:07Z",
    "modified": "2026-07-14T11:35:23Z",
    "license": "https://creativecommons.org/licenses/by-sa/4.0/",
    "record_history": [
      {
        "change_type": "create",
        "changed_at": "2026-05-04T15:37:07Z",
        "changed_by": "https://orcid.org/0000-0002-7747-6854",
        "release": "v0.1.0-phase0",
        "note": "Initial canonicalization from al-Aʿlām alam_id=10604 by el-alam adapter (Hafta 4) [Track B — no DİA cross-ref]."
      },
      {
        "change_type": "update",
        "changed_at": "2026-07-14T11:35:23Z",
        "changed_by": "https://orcid.org/0000-0002-7747-6854",
        "release": "v0.1.0-phase0",
        "note": "alam-detail augment (H11 S10): gap-fill alt.ar+alt.tr+translit from alam_detail.json el-alam:10604."
      }
    ],
    "deprecated": false
  },
  "death_temporal": {
    "start_ah": 1236,
    "start_ce": 1821,
    "approximation": "exact"
  },
  "note": "El-Aʿlām (Ziriklī) cross-reference: alam_id=10604, heading_ar=أبو إسحاق زاده || Ziriklī century_ce=19 || Ziriklī place coords (city/region of activity): 33.85, 35.6"
}
