{
  "@id": "iac:person-00014793",
  "@type": [
    "iac:Person"
  ],
  "labels": {
    "prefLabel": {
      "en": "al-ʿAbid",
      "tr": "Âbid",
      "ar": "العابد"
    },
    "originalScript": {
      "ar": "العابد"
    },
    "description": {
      "tr": "Yemen'li tarihçi, kadılardan",
      "en": "Yemenite historian, among the judges"
    },
    "transliteration": {
      "ar-Latn-x-alalc": "ʿAlī b. Muḥammad b. Aḥmad b. ʿAbd Allāh al-ʿĀbid"
    },
    "altLabel": {
      "tr": [
        "Alî b. Muhammed b. Ahmed b. Abdullâh el-Âbid"
      ],
      "ar": [
        "علي بن محمد بن أحمد بن عبد الله العابد"
      ]
    }
  },
  "profession": [
    "historian"
  ],
  "provenance": {
    "derived_from": [
      {
        "source_id": "el-alam:7476",
        "source_type": "tertiary_reference",
        "page_or_locator": "al-Ziriklī, al-Aʿlām (8th ed. 2002), entry alam_id=7476",
        "extraction_method": "structured_json",
        "edition_or_version": "Khayr al-Dīn al-Ziriklī, al-Aʿlām (Beirut: Dār al-ʿIlm li’l-Malāyīn, 8th ed. 2002), 8 vols."
      }
    ],
    "generated_by": {
      "pipeline_name": "canonicalize_person_el_alam",
      "pipeline_version": "v0.1.0"
    },
    "generated_at": "2026-05-04T15:36:35Z",
    "attributed_to": "https://orcid.org/0000-0002-7747-6854",
    "created": "2026-05-04T15:36:35Z",
    "modified": "2026-07-14T11:35:23Z",
    "license": "https://creativecommons.org/licenses/by-sa/4.0/",
    "record_history": [
      {
        "change_type": "create",
        "changed_at": "2026-05-04T15:36:35Z",
        "changed_by": "https://orcid.org/0000-0002-7747-6854",
        "release": "v0.1.0-phase0",
        "note": "Initial canonicalization from al-Aʿlām alam_id=7476 by el-alam adapter (Hafta 4) [Track B — no DİA cross-ref]."
      },
      {
        "change_type": "update",
        "changed_at": "2026-07-14T11:35:23Z",
        "changed_by": "https://orcid.org/0000-0002-7747-6854",
        "release": "v0.1.0-phase0",
        "note": "alam-detail augment (H11 S10): gap-fill alt.ar+alt.tr+translit from alam_detail.json el-alam:7476."
      }
    ],
    "deprecated": false
  },
  "death_temporal": {
    "start_ah": 1189,
    "start_ce": 1775,
    "approximation": "exact"
  },
  "note": "El-Aʿlām (Ziriklī) cross-reference: alam_id=7476, heading_ar=العابد || Ziriklī century_ce=18 || Ziriklī place coords (city/region of activity): 15.35, 44.21"
}
