{
  "@id": "iac:person-00003383",
  "@type": [
    "iac:Person",
    "iac:Scholar"
  ],
  "labels": {
    "prefLabel": {
      "tr": "HEREVÎ, Ahmed b. Muhammed",
      "ar": "أحمد بن محمّد الهروي"
    },
    "originalScript": {
      "ar": "أحمد بن محمّد الهروي"
    },
    "altLabel": {
      "tr": [
        "Ebû Ubeyd Ahmed b. Muhammed b. Muhammed el-Herevî el-Bâşânî"
      ]
    },
    "description": {
      "tr": "Hayatı hakkında yeterli bilgi yoktur. Abdülkays b. Rebîa soyundan geldiği için Abdî, Herat’ın bir köyü olan Bâşân’a (Fâşân) nisbetle Bâşânî (Fâşânî) nisbeleriyle de anılmaktadır. Herevî’nin, Fâşânî nisbesini Merv’e bağlı Fâşân köyünden aldığını zannederek onu Mervezî nisbesiyle ananlar da olmuştur. İbn Hallikân, Herevî’nin dedesinin adını Muhammed olarak kaydettikten sonra Kitâbü’l-Ġarîbeyn adlı eserinin kapağında Abdurrahman olarak gördüğünü ifade etmiştir ( Vefeyât , I, 96). Ebû Süleyman Ahmed b. Muhammed el-Hattâbî, Ahmed b. Muhammed el-Herevî, Ebû İshak Ahmed b. Muhammed el-Bezzâz’dan hadis, Tehẕîbü’l-luġa adlı eserin sahibi Muhammed b. Ahmed el-Ezherî’den lugat tahsil eden Herevî’nin talebeleri arasında Ebû Osman İsmâil b. Abdurrahman es-Sâbûnî, Ebû Ömer Abdülvâhid b. Ahmed el-Melîhî, Ebû Sehl Muhammed b. Ali el-Herevî, Ebû Bekir Muhammed b. İbrâhim el-Erdistânî gibi kişiler yer almaktadır. Hânsârî’nin, Süyûtî’den naklen Herevî’nin İbnü’s-Serrâc (ö. 316/929) ve Niftaveyh (ö. 323/935) gibi âlimlerden ders aldığına dair verdiği bilgiler ( Ravżâtü’l-cennât , I, 241-242) doğru değildir. Gizlice içki içmek gibi bazı kötü alışkanlıklarının bulunduğu da rivayet edilen Herevî 6 Receb 401 (13 Şubat 1011) tarihinde vefat etmiştir. Eserleri. Herevî’nin günümüze ulaşan eseri Kitâbü’l-Ġarîbeyn fi’l-Ḳurʾân ve’l-ḥadîs̱ adını taşımakta olup Kitâbü’l-Ġarîbeyn: ġarîbeyi’l-Ḳurʾân ve’l-ḥadîs̱ , Ġarîbeyi’l-Ḳurʾân ve’s-sünne , Kitâbü’l-Ġarîbeyn fî luġati kelâmillâh ve eḥâdîs̱i resûlih gibi isimlerle de anılmaktadır. Eserde yer alan kelimeler alfabetik olarak sıralanmış, madde başlıkları bablarla gösterilmiştir. Âyet ve hadislerde geçtiği kalıpla ele alınan kelimeler lugat, i‘rab ve anlam açısından izah edilmeye çalışılmıştır. Garîb lafızların yer aldığı âyet ve hadis metinlerinin sadece ilgili kısmı zikredilmiş, bazan şiirlerden de örnekler verilmiştir. Garîbü’l-Kur’ân ve garîbü’l-hadîs konularında daha önce yazılan eserler içinde özellikle Ebû Ubeyd Kāsım b. Sellâm ve İbn Kuteybe’nin kitaplarından büyük ölçüde faydalanılarak kaleme alınan, Zerkeşî’nin garîbü’l-Kur’ân konusunda telif edilmiş en önemli eserlerden olduğunu belirttiği Kitâbü’l-Ġarîbeyn ilim çevrelerinde haklı bir şöhrete kavuşmuş; gerek Kur’an ve hadislerdeki garîb kelimeleri bir araya getirmesi, gerekse bunları alfabetik biçimde sıralaması açısından kendi alanında yazılan ilk eser olarak kabul edilmiştir. Herevî’nin bu kitabında uyguladığı metot daha sonra gelen birçok âlim tarafından benimsenmiştir. Nitekim Mecdüddin İbnü’l-Esîr’in garîbü’l-hadîse dair en-Nihâye adlı eserini telif ederken esas aldığı iki kitaptan biri Kitâbü’l-Ġarîbeyn olmuştur. Harîrî Dürretü’l-ġavvâṣ ’ında, İbn Ebü’l-Hadîd Şerḥu Nehci’l-belâġa ’sında, Muhammed b. Ahmed el-Kurtubî el-Câmiʿ li-aḥkâmi’l-Ḳurʾân ’ında, Nevevî el-Minhâc fî şerḥi Ṣaḥîḥi Müslim ’inde ve Şehâbeddin el-Hafâcî Şifâʾü’l-ġalîl ’inde bu eserden faydalanmıştır. Mecdüddin Ebü’l-Mekârim Ali b. Muhammed en-Nahvî Kitâbü’l-Ġarîbeyn ’i Muḫtaṣarü’l-Ġarîbeyn adıyla ihtisar etmiş, Ebû Mûsâ el-Medînî esere el-Mecmûʿu’l-muġīs̱ fî ġarîbi (ġarîbeyi)’l-Ḳurʾân ve’l-ḥadîs̱ adıyla bir tekmile yazmış (nşr. Abdülkerîm el-Azbâvî, I-III, Cidde 1406-1408/1986-1988), İbn Asker el-Gassânî de buna bazı ilâvelerde bulunarak el-Meşreʿu’r-revî fi’z-ziyâdeti ʿalâ Ġarîbeyi’l-Herevî adlı eserini meydana getirmiştir. Bunlardan başka İbn Nâsır es-Selâmî, Kitâbü’l-Ġarîbeyn ’deki nakil ve zabt hatalarını, özellikle de Herevî’nin talebelerinden İsmâil b. Abdurrahman es-Sâbûnî ve Ebû Ömer el-Melîhî’nin rivayetleriyle gelen yanlışları göstermek için et-Tenbîh ʿalâ ḫaṭaʾi’l-Ġarîbeyn ( et-Tenbîh ʿale’l-elfâẓi’lletî vaḳaʿa ḫaṭaʾ fî naḳlihâ ev żabṭıhâ ev tefsîrihâ fî Kitâbi’l-Ġarîbeyn ) adıyla bir eser kaleme almıştır (bu eserlerin yazma nüshaları için bk. Sezgin, VIII, 226). Çeşitli kütüphanelerde çok sayıda nüshası bulunan ( a.g.e. , VIII, 225-226) Kitâbü’l-Ġarîbeyn ’in I. cildi Mahmûd Muhammed et-Tanâhî tarafından neşredilmiş (Kahire 1390/1970), eser daha sonra Haydarâbâd’da da basılmıştır (I-IV, 1406-1410/1985-1989). żabṭıhâ ev tefsîrihâ fî Kitâbi’l-Ġarîbeyn ) adıyla bir eser kaleme almıştır (bu eserlerin yazma nüshaları için bk. Sezgin, VIII, 226). Çeşitli kütüphanelerde çok sayıda nüshası bulunan ( a.g.e. , VIII, 225-226) Kitâbü’l-Ġarîbeyn ’in I. cildi Mahmûd Muhammed et-Tanâhî tarafından neşredilmiş (Kahire 1390/1970), eser daha sonra Haydarâbâd’da da basılmıştır (I-IV, 1406-1410/1985-1989). Herevî’nin kaynaklarda zikredilen Kitâbü Vülâti Herât adlı eserinin günümüze kadar gelip gelmediği bilinmemektedir. İsmâil Paşa’nın Herevî’ye nisbet ettiği Erbaʿûne fi’l-ḥadîs̱ ( Hediyyetü’l-ʿârifîn , I, 70) Ahmed b. Muhammed el-Mâlînî el-Herevî’ye (ö. 412/1022) ait olmalıdır. Bu madde TDV İslâm Ansiklopedisi’nin 1998 yılında İstanbul’da basılan 17. cildinde, 220-221 numaralı sayfalarda yer almıştır. Matbu nüshayı pdf dosyası olarak indirmek için tıklayınız."
    }
  },
  "profession": [
    "scholar"
  ],
  "provenance": {
    "derived_from": [
      {
        "source_id": "dia:herevi-ahmed-b-muhammed",
        "source_type": "tertiary_reference",
        "page_or_locator": "DİA, slug=herevi-ahmed-b-muhammed, https://islamansiklopedisi.org.tr/herevi-ahmed-b-muhammed",
        "extraction_method": "structured_json",
        "edition_or_version": "Türkiye Diyanet Vakfı İslâm Ansiklopedisi (DİA), online edition; pipeline ETL."
      },
      {
        "source_id": "dia-chunks-v8:herevi-ahmed-b-muhammed",
        "source_type": "tertiary_reference",
        "page_or_locator": "DİA chunks (per-slug aggregated), slug=herevi-ahmed-b-muhammed",
        "extraction_method": "structured_json",
        "edition_or_version": "Türkiye Diyanet Vakfı İslâm Ansiklopedisi (DİA), dia_chunks.json source; H8 dia_person_enrichment_v8 upgrade pass."
      }
    ],
    "generated_by": {
      "pipeline_name": "canonicalize_person_dia",
      "pipeline_version": "v0.1.0"
    },
    "generated_at": "2026-05-04T15:34:14Z",
    "attributed_to": "https://orcid.org/0000-0002-7747-6854",
    "created": "2026-05-04T15:34:14Z",
    "modified": "2026-07-14T16:47:21Z",
    "license": "https://creativecommons.org/licenses/by-sa/4.0/",
    "record_history": [
      {
        "change_type": "create",
        "changed_at": "2026-05-04T15:34:14Z",
        "changed_by": "https://orcid.org/0000-0002-7747-6854",
        "release": "v0.1.0-phase0",
        "note": "Initial canonicalization from DİA slug=herevi-ahmed-b-muhammed (2 chunks) by dia adapter (Hafta 4)."
      },
      {
        "change_type": "update",
        "changed_at": "2026-05-17T07:06:22Z",
        "changed_by": "https://orcid.org/0000-0002-7747-6854",
        "release": "v0.1.0",
        "note": "H8 Stage 3 dia_person_enrichment_v8 (slug=herevi-ahmed-b-muhammed)."
      },
      {
        "change_type": "update",
        "changed_at": "2026-07-14T16:47:21Z",
        "changed_by": "https://orcid.org/0000-0002-7747-6854",
        "release": "v0.1.0-phase0",
        "note": "dia-relations edges (H11 S11 rev): teachers/students from dia_relations.json ts=[talebe,hoca] (yön popülasyon kanıtıyla düzeltildi; çift-yönlüler uygulanmadı)."
      }
    ],
    "deprecated": false
  },
  "nisba": [
    "Herevî; Bâşânî"
  ],
  "death_temporal": {
    "start_ah": 401,
    "start_ce": 1011,
    "approximation": "exact"
  },
  "note": "DİA cross-reference: slug=herevi-ahmed-b-muhammed, URL: https://islamansiklopedisi.org.tr/herevi-ahmed-b-muhammed || DİA death-date string: (ö. 401/1011) || DİA categories: hadis > rivayet > tefsir || Chunk count: 2",
  "teachers": [
    "iac:person-00003328"
  ],
  "students": [
    "iac:person-00006517"
  ]
}
